{
  "version": 1,
  "updated_at": "2026-04-30T04:45:43Z",
  "currency_rates": {
    "usd_jpy": 156.2,
    "rates_updated_at": "2026-04-30T00:00:00Z",
    "source": "manual"
  },
  "people": [
    {
      "id": "elon-musk",
      "name": {
        "ja": "イーロン・マスク",
        "en": "Elon Musk"
      },
      "annual_income": {
        "amount_usd": 69696969696,
        "source_currency": "usd",
        "is_estimated": true,
        "note": "Forbes 2026 推定値 — リリース前に最新値に更新",
        "amount_jpy": 10886666666515
      },
      "image": {
        "asset_name": "avatar_elon-musk",
        "emoji_fallback": "🚀"
      },
      "category": "tech_billionaire",
      "rank_hint": 1
    },
    {
      "id": "jeff-bezos",
      "name": {
        "ja": "ジェフ・ベゾス",
        "en": "Jeff Bezos"
      },
      "annual_income": {
        "amount_usd": 16030000000,
        "source_currency": "usd",
        "is_estimated": true,
        "note": "Forbes 2026 推定値 — リリース前に最新値に更新",
        "amount_jpy": 2503886000000
      },
      "image": {
        "asset_name": "avatar_jeff-bezos",
        "emoji_fallback": "📦"
      },
      "category": "tech_billionaire",
      "rank_hint": 2
    },
    {
      "id": "mark-zuckerberg",
      "name": {
        "ja": "マーク・ザッカーバーグ",
        "en": "Mark Zuckerberg"
      },
      "annual_income": {
        "amount_usd": 12800000000,
        "source_currency": "usd",
        "is_estimated": true,
        "note": "Forbes 2026 推定値 — リリース前に最新値に更新",
        "amount_jpy": 1999360000000
      },
      "image": {
        "asset_name": "avatar_mark-zuckerberg",
        "emoji_fallback": "👓"
      },
      "category": "tech_billionaire",
      "rank_hint": 3
    },
    {
      "id": "bernard-arnault",
      "name": {
        "ja": "ベルナール・アルノー",
        "en": "Bernard Arnault"
      },
      "annual_income": {
        "amount_usd": 9600000000,
        "source_currency": "usd",
        "is_estimated": true,
        "note": "Forbes 2026 推定値 — リリース前に最新値に更新",
        "amount_jpy": 1499520000000
      },
      "image": {
        "asset_name": "avatar_bernard-arnault",
        "emoji_fallback": "👜"
      },
      "category": "luxury_billionaire",
      "rank_hint": 4
    },
    {
      "id": "larry-page",
      "name": {
        "ja": "ラリー・ペイジ",
        "en": "Larry Page"
      },
      "annual_income": {
        "amount_usd": 6400000000,
        "source_currency": "usd",
        "is_estimated": true,
        "note": "Forbes 2026 推定値 — リリース前に最新値に更新",
        "amount_jpy": 999680000000
      },
      "image": {
        "asset_name": "avatar_larry-page",
        "emoji_fallback": "🔍"
      },
      "category": "tech_billionaire",
      "rank_hint": 5
    },
    {
      "id": "bill-gates",
      "name": {
        "ja": "ビル・ゲイツ",
        "en": "Bill Gates"
      },
      "annual_income": {
        "amount_usd": 5100000000,
        "source_currency": "usd",
        "is_estimated": true,
        "note": "Forbes 2026 推定値 — リリース前に最新値に更新",
        "amount_jpy": 796620000000
      },
      "image": {
        "asset_name": "avatar_bill-gates",
        "emoji_fallback": "💻"
      },
      "category": "tech_billionaire",
      "rank_hint": 6
    },
    {
      "id": "warren-buffett",
      "name": {
        "ja": "ウォーレン・バフェット",
        "en": "Warren Buffett"
      },
      "annual_income": {
        "amount_usd": 4500000000,
        "source_currency": "usd",
        "is_estimated": true,
        "note": "Forbes 2026 推定値 — リリース前に最新値に更新",
        "amount_jpy": 702900000000
      },
      "image": {
        "asset_name": "avatar_warren-buffett",
        "emoji_fallback": "📈"
      },
      "category": "investor_billionaire",
      "rank_hint": 7
    },
    {
      "id": "shohei-ohtani",
      "name": {
        "ja": "大谷翔平",
        "en": "Shohei Ohtani"
      },
      "annual_income": {
        "amount_usd": 70000000,
        "source_currency": "usd",
        "is_estimated": true,
        "note": "LAドジャース契約総額 $700M / 10年 — リリース前に最新値に更新",
        "amount_jpy": 10934000000
      },
      "image": {
        "asset_name": "avatar_shohei-ohtani",
        "emoji_fallback": "⚾"
      },
      "category": "athlete",
      "rank_hint": 8
    }
  ]
}
